source_id,source_name,source_type,source_group,content_mode,authority_level,credibility_level,content_type,research_role,market_scope,access_method,acquisition_mode,update_frequency,latency_class,as_of_date_required,usable_for,url_or_path,last_checked_date,publisher,notes,coverage,upstream_sources
etfcom_launches_2026_05_09,ETF.com ETF Launches table,text,social_and_community,news,L4,B,evidence,signal,US,web_search,free,event_driven,live,yes,"etf_discovery;launch_table;candidate_generation",https://www.etf.com/tools/etf-launches,2026-05-09,ETF.com,"Launch table used to identify recent US ETF tickers inception dates and fund names. Treat as discovery signal and confirm important candidates with issuer or exchange sources.","US ETF launches 2026",
etfcom_corgi_launch_2026_05_06,ETF.com Corgi launches 34 ETFs article,text,social_and_community,news,L4,B,logic,signal,US,web_search,free,event_driven,live,yes,"etf_discovery;corgi_launch;theme_context",https://www.etf.com/sections/features/corgi-launches-34-etfs-raises-160m-single-day,2026-05-09,ETF.com,"Used for Corgi batch launch themes fees competitor context and ETF.com analyst framing. Needs issuer/exchange confirmation before full analysis.","Corgi May 2026 ETF batch",
proshares_buyb_launch_2026_05_07,ProShares BUYB launch release,text,official_and_industry,press_release,L1,A,fact,primary,US,web_search,free,event_driven,live,yes,"etf_discovery;issuer_confirmation;buyb_launch",https://www.proshares.com/press-releases/proshares-launches-the-first-etf-targeting-companies-with-a-sustained-history-of-share-buybacks,2026-05-09,ProShares,"Issuer launch release confirming BUYB objective and buyback-aristocrats positioning.","BUYB launch",
proshares_buyb_product_2026_05_09,ProShares BUYB product page,text,official_and_industry,dataset,L1,A,fact,primary,US,web_search,free,daily,live,yes,"etf_discovery;product_terms;buyb_analysis",https://www.proshares.com/our-etfs/strategic/buyb,2026-05-09,ProShares,"Product page used for ticker inception date expense ratio net assets and index description.","BUYB product details",
defiance_amkl_launch_2026_05_05,Defiance AMKL launch release,text,official_and_industry,press_release,L1,A,fact,primary,US,web_search,free,event_driven,live,yes,"etf_discovery;single_stock_leverage;semiconductor",https://www.globenewswire.com/news-release/2026/05/05/3287849/0/en/Defiance-Launches-AMKL-The-First-Daily-2X-Long-ETF-for-Amkor-Technology-Inc.html,2026-05-09,Defiance ETFs,"Issuer release confirming AMKL launch and 2x daily AMKR objective.","AMKL launch",
defiance_ama_launch_2026_05_01,Defiance AMA launch release,text,official_and_industry,press_release,L1,A,fact,primary,US,web_search,free,event_driven,live,yes,"etf_discovery;single_stock_leverage;semiconductor",https://www.globenewswire.com/news-release/2026/05/01/3285977/0/en/defiance-launches-ama-the-first-daily-2x-long-etf-for-applied-materials-inc.html,2026-05-09,Defiance ETFs,"Issuer release confirming AMA launch and 2x daily AMAT objective.","AMA launch",
