methodology_topic,search_date,query_family,query_text,language_or_circle,source_bucket,target_pattern,result_quality,next_step,notes
options-flow-analysis,2026-06-03,derived_internal,"repo search flow-intent-inference technical-market-pricing-context overlay-routing options positioning",zh,derived_internal,mira_routing_gap,high,wire_into_trial_framework,"Existing Mira methods either record options snapshot fields or infer broad visible-flow intent. A large structured options-flow dataset justifies a specialist framework with data-quality gates and validation slices."
options-flow-analysis,2026-06-03,official_market_data,"OCC options volume open interest query",en,official_market_data,options_data_source,medium,use_for_data_source_policy,"OCC source supports official options data context. Framework still needs raw user dataset provenance and field-level audit before conclusions can exceed exploratory. https://www.theocc.com/market-data/market-data-reports/volume-and-open-interest/volume-query"
options-flow-analysis,2026-06-03,academic,"Pan Poteshman information option volume future stock prices",en,academic_market_microstructure,options_informed_trading_support,high,use_as_supporting_evidence,"Supports possibility that buyer-initiated opening option volume contains information, but key labels are not always public. This motivates opening-flow confidence and lookahead-bias controls. https://www.nber.org/papers/w10925"
options-flow-analysis,2026-06-03,academic_event,"options earnings announcements volume open interest liquidity",en,academic_market_microstructure,event_window_options_context,medium,use_for_event_validation_slice,"Options volume OI IV and spreads change around earnings; use as event-window design support, not directional proof. https://ideas.repec.org/a/bla/eufman/v6y2000i2p149-171.html"
options-flow-analysis,2026-06-03,contradiction,"options volume as noise earnings announcements retail zero commission",en,academic_contradiction,false_positive_risk,medium,expand_failure_cases,"Contradiction seed highlights retail/noise and regime risks. Use to require false-positive validation before adoption. https://papers.ssrn.com/sol3/Delivery.cfm/6448100.pdf?abstractid=6448100&mirid=1"
options-flow-analysis,2026-06-03,user_dataset_pending,"user options flow dataset schema prior analysis",user_dataset,user_dataset,data_quality_gate,source_gap,request_schema_and_validation_outputs,"Next step is to ingest dataset schema, raw fields, vendor/source limitations, prior analysis notebooks or summary statistics, and validation labels."
