variable,consensus_proxy,mira_view,evidence_status,price_in_status,next_check
quality_platform_status,"Market generally recognizes Apple as a high-quality mega-cap platform","Mira agrees; this is not the variant edge",medium,"mostly_price_in","Next 10-Q / annual filing and services margin trend"
product_cycle,"Market debate centers on iPhone cycle, AI roadmap and new product timing","Product-cycle risk matters, but current thesis does not require a single product catalyst",medium,"partly_price_in","Next earnings call and credible product schedule evidence"
services_growth,"Consensus expects services to support growth and margin resilience","Services remain a key durability pillar; monitor regulatory and mix pressure",medium,"partly_price_in","Segment revenue and gross margin disclosure"
valuation_multiple,"Large-mega valuation embeds quality and capital return resilience","Upside requires either estimate revision or reduced risk premium, not just quality restatement",medium,"mostly_price_in","Forward multiple and estimate revision after next results"
tariff_regulatory_risk,"Market treats tariff/regulatory pressure as recurring risk","Mira treats it as a key disconfirming path if it hits gross margin or ecosystem economics",medium,"partly_price_in","Company guidance, filings and policy changes"
