method_name,status,target_case,expected_increment,falsification_condition,notes
long-term-integrated-thesis,trial,"AAPL-like mega-cap platform; HIMS-like consumer/product mid-cap; one failed growth story; one cyclical/macro-sensitive company","Integrate consumer, product, macro, industry, company and valuation expectations into one long-term thesis map with explicit conflicts and refresh triggers.","If it does not improve over ordinary long_term_thesis in identifying the weakest assumption, market-implied expectations and falsification triggers, do not adopt.","Proposed as main workflow candidate."
consumer_demand_lens,trial,"consumer brand, marketplace, subscription, healthcare consumer access case","Prevent demand claims from relying only on TAM or management commentary by checking adoption path, affordability, substitution, retention and channel behavior.","If public or primary evidence cannot support demand variables beyond generic market growth, keep as optional only.","Candidate lens."
product_reality_lens,trial,"software, platform, consumer tech, device, medical product case","Test whether product actually solves a customer job and passes value/usability/feasibility/viability risks.","If it routinely becomes qualitative product praise without measurable adoption or retention evidence, retire or narrow.","Candidate lens."
macro_economy_lens,trial,"high-duration growth, cyclical, export chain, financial, consumer discretionary case","Translate macro regime into revenue, margin, financing, discount-rate, valuation and positioning channels.","If it frequently misclassifies company/industry questions as macro questions, keep macro as overlay only.","Candidate lens."
industry_structure_lens,trial,"semiconductor supply chain, consumer platform, industrial, healthcare services case","Map profit pool, supplier/customer power, competitive intensity, regulation, technology route and industry life cycle.","If it produces static Porter-style summaries without identifying the changing profit pool, revise.","Candidate lens."
company_execution_lens,trial,"compounder, turnaround, early-stage growth, capital-intensive industrial case","Convert company quality into ROIC, reinvestment runway, management capital allocation, financial quality and execution evidence.","If it over-penalizes early-stage firms or misses dilution/survival risks, split by maturity stage.","Candidate lens."
valuation_expectations_bridge,trial,"all investable long-term single-equity cases","Reverse-engineer market-implied growth, margin, ROIC, duration and risk-premium assumptions before judging opportunity.","If proxies are too weak and create fake precision, require confidence labels and ranges instead of point estimates.","Mandatory bridge candidate."
