source_id,source_name,source_type,source_group,content_mode,authority_level,credibility_level,content_type,research_role,market_scope,access_method,acquisition_mode,update_frequency,latency_class,as_of_date_required,usable_for,url_or_path,last_checked_date,publisher,notes,upstream_sources
hkexnews_listed_company_publications,HKEXnews listed company publications,text,official_and_industry,filing,L2,A,fact,primary,HK,web_read,free,real_time,filing_cycle,yes,"filings;announcements;financial;governance;event;HK",https://www.hkexnews.hk/index.htm,2026-06-03,HKEXnews,"Primary HKEXnews portal for Hong Kong listed-company announcements reports circulars and listing documents. Case evidence must record stock code document title publish date and document URL.",
hkex_new_listing_information,HKEX new listing information,text,official_and_industry,filing,L2,A,fact,primary,HK,web_read,free,event_driven,live,yes,"ipo;new_listing;prospectus;allotment;HK",https://www2.hkexnews.hk/New-Listings/New-Listing-Information/Main-Board?sc_lang=en,2026-06-03,HKEXnews,"Main Board new-listing entry point for prospectuses allotment results and listing announcements. Confirm issuer-specific facts against the specific document.",
hkex_ccass_shareholding_search,HKEX CCASS shareholding search,structured,official_and_industry,dataset,L2,A,evidence,secondary,HK,web_read,free,daily,delayed,yes,"ownership;float_context;custody;southbound;HK",https://www.hkexnews.hk/sdw/search/searchsdw.aspx,2026-06-03,HKEXnews,"Public CCASS shareholding search for custody and participant shareholding context. Not a complete beneficial ownership source; record shareholding date and stock code.",
jpx_company_announcements_service,JPX Company Announcements Service,text,official_and_industry,filing,L2,A,fact,primary,JP,web_read,free,real_time,filing_cycle,yes,"filings;announcements;financial;governance;event;Japan",https://www.jpx.co.jp/english/listing/disclosure/,2026-06-03,Japan Exchange Group,"English-language timely disclosure service for TDnet-published listed-company information. For thesis-critical details verify against Japanese TDnet disclosure or issuer IR when translation scope is partial.",
jpx_listed_company_search,JPX listed company search,structured,official_and_industry,dataset,L2,A,evidence,secondary,JP,web_read,free,daily,delayed,yes,"issuer_lookup;listing_status;governance;filings;Japan",https://www.jpx.co.jp/english/listing/co-search/,2026-06-03,Japan Exchange Group,"Listed-company search for basic issuer data timely disclosures filing information and governance links. Use as navigation and listing-status source.",
edinet_disclosure_system,EDINET disclosure system,text,official_and_industry,filing,L2,A,fact,primary,JP,web_read,free,real_time,filing_cycle,yes,"filings;annual_report;securities_report;governance;Japan",https://disclosure2.edinet-fsa.go.jp/,2026-06-03,Japan Financial Services Agency,"Official Japanese disclosure system for securities reports and statutory filings. Case evidence must record EDINET code document type submission date period and document URL.",
mops_twse_disclosure_search,Taiwan MOPS disclosure search,text,official_and_industry,filing,L2,A,fact,primary,TW,web_read,free,real_time,filing_cycle,yes,"filings;announcements;financial;governance;event;Taiwan",https://mops.twse.com.tw/mops/web/ezsearch,2026-06-03,Market Observation Post System,"Primary Taiwan disclosure search for listed-company announcements and filings. Case evidence must record company code title publish date and document route.",
twse_market_statistics,TWSE market statistics and trading data,structured,official_and_industry,dataset,L2,A,fact,secondary,TW,web_read,free,daily,delayed,yes,"market_data;price_history;volume;listing_status;Taiwan",https://www.twse.com.tw/en/page/trading/exchange/STOCK_DAY.html,2026-06-03,Taiwan Stock Exchange,"Official TWSE trading statistics entry point for daily price and volume context. Record date range company code and table route; use issuer filings for company facts.",
english_dart_fss,Korea English DART disclosure portal,text,official_and_industry,filing,L2,A,evidence,secondary,KR,web_read,free,real_time,filing_cycle,yes,"filings;announcements;financial;governance;event;Korea",https://englishdart.fss.or.kr/,2026-06-03,Financial Supervisory Service,"English DART portal for Korean corporate disclosures. English disclosures can be voluntary and non-legal translations; thesis-critical facts should be checked against Korean DART filings.",
opendart_fss_api,Korea OpenDART API,structured,official_and_industry,dataset,L2,A,fact,primary,KR,public_api,free_with_key,real_time,filing_cycle,yes,"filings;financial;ownership;event;Korea",https://opendart.fss.or.kr/,2026-06-03,Financial Supervisory Service,"Official public API for Korean DART disclosures and financial statement data. Requires API key for normal scripted use and must record corp code report code period and filing receipt number.",
krx_kind_disclosure_system,KRX KIND disclosure system,text,official_and_industry,filing,L2,A,evidence,secondary,KR,web_read,free,real_time,filing_cycle,yes,"exchange_disclosure;listing_status;market_structure;Korea",https://kind.krx.co.kr/main.do?method=loadInitPage,2026-06-03,Korea Exchange,"Korea Exchange disclosure and listed-company information portal. Use for exchange disclosure and market-structure context; confirm statutory filing facts with DART when possible.",
esma_issuer_disclosure_hub,ESMA issuer disclosure hub,text,official_and_industry,policy_report,L2,A,evidence,secondary,EU,web_read,free,irregular,archival,yes,"issuer_disclosure;regulation;financial_reporting;Europe",https://www.esma.europa.eu/esmas-activities/investors-and-issuers/issuer-disclosure,2026-06-03,ESMA,"EU issuer-disclosure policy hub for financial reporting corporate finance and transparency context. Use to route European disclosure requirements and enforcement context, not issuer-specific filings.",
ec_transparency_oam_directory,EU transparency requirements and OAM directory,text,official_and_industry,policy_report,L2,A,evidence,secondary,EU,web_read,free,irregular,archival,yes,"issuer_disclosure;regulation;OAM;Europe",https://finance.ec.europa.eu/capital-markets-union-and-financial-markets/company-reporting-and-auditing/company-reporting/transparency-requirements-listed-companies_en,2026-06-03,European Commission,"Transparency Directive context and route to officially appointed mechanisms for national storage of regulated information. Use the issuer's national OAM or company IR for specific filing evidence.",
euronext_live_markets,Euronext live markets pages,structured,market_data,market_data,L5,B,fact,secondary,EU,web_read,free,daily,delayed,yes,"market_data;price_context;volume;listing_status;Europe",https://live.euronext.com/en/markets,2026-06-03,Euronext,"Public Euronext market pages for quote and listing context across Euronext venues. Treat as delayed market data and record venue ticker ISIN date and quote time.",
