metric,CoreWeave_CRWV_Q1_2026,Oracle_ORCL_FY2026_Q3,read_through
period_end,2026-03-31,2026-02-28,"Timing mismatch of one month; acceptable for AI cloud demand cross-check."
revenue_growth_yoy,112%,22%,"CRWV has much higher growth off a smaller base."
cloud_or_ai_infra_growth,"Revenue $2.078B; AI cloud demand/backlog focus","Cloud Infrastructure revenue $4.9B, +84% YoY","Oracle validates broad AI infrastructure demand."
backlog_or_rpo,"Revenue backlog $99.4B, +284% YoY","RPO $553B, +325% YoY","Both show contract demand is not isolated to CRWV."
profitability,"GAAP net loss $740M; adjusted operating margin 1%","GAAP net income $3.7B; non-GAAP operating margin 43%","Oracle has a much stronger funding/profitability cushion."
capex_or_funding,"Q1 purchase of PPE $7.695B; DDTL 4.0 $8.5B; NVIDIA equity $2B","FY2026 capex guide $50B; raised $30B after announcing up to $50B financing","AI cloud buildout is capital intensive across the group."
customer_or_contract_quality,"Meta $21B commitment, Anthropic agreement, expanding AI-native customers","Oracle says most large AI RPO increase is customer-prepaid or customer-supplied GPU related","Oracle's structure appears less balance-sheet risky."
peer_signal,"Strong demand but high execution and funding risk","Strong demand with better current profitability","Peer check supports demand thesis but highlights CRWV-specific leverage and timing risk."
